{
  "stack": "preview",
  "run_id": "r42",
  "owner": "example-owner",
  "created_at": "2026-09-26T12:00:00Z",
  "expires_at": "2026-09-27T12:00:00Z",
  "origin": "https://preview-r42.registry-preview.example.invalid",
  "audience": "https://preview-r42.registry-preview.example.invalid",
  "protected_resource_metadata_url": "https://preview-r42.registry-preview.example.invalid/.well-known/oauth-protected-resource",
  "production_origin": "https://registry.example.invalid",
  "commit": "0000000000000000000000000000000000000000",
  "config_hash": "0000000000000000000000000000000000000000000000000000000000000000",
  "status": "created"
}
